{
  "$schema": "https://json-schema.org/draft/2020-12/schema",
  "$id": "https://raw.githubusercontent.com/jwildfire/safety.viz/main/src/data/schema/portfolio.json",
  "title": "safety.viz portfolio manifest",
  "description": "The shape of src/data/portfolio.json: the standard domain set a study supplies, and for every chart module the domains it reads and the column each of its settings defaults to. Unlike its neighbours in this directory, this is not a chart's data contract; it describes the manifest that sits across all of them.",
  "type": "object",
  "required": ["version", "description", "domains", "modules"],
  "additionalProperties": false,
  "properties": {
    "$schema": { "type": "string" },
    "version": {
      "type": "integer",
      "minimum": 1,
      "description": "Manifest format version; raised when the shape below changes."
    },
    "description": { "type": "string", "minLength": 1 },
    "domains": {
      "type": "object",
      "description": "The standard domain set, keyed by domain id.",
      "required": ["subject", "ae", "bds", "eg"],
      "additionalProperties": false,
      "properties": {
        "subject": { "$ref": "#/$defs/domain" },
        "ae": { "$ref": "#/$defs/domain" },
        "bds": { "$ref": "#/$defs/domain" },
        "eg": { "$ref": "#/$defs/domain" }
      }
    },
    "modules": {
      "type": "object",
      "description": "Every chart module, keyed by its module name (the name of its data schema file).",
      "minProperties": 1,
      "propertyNames": { "pattern": "^[a-z][a-z0-9-]*$" },
      "additionalProperties": { "$ref": "#/$defs/module" }
    }
  },
  "$defs": {
    "domainId": { "enum": ["subject", "ae", "bds", "eg"] },
    "domain": {
      "type": "object",
      "required": ["label", "grain", "demo", "columns"],
      "additionalProperties": false,
      "properties": {
        "label": { "type": "string", "minLength": 1, "description": "Display name of the domain." },
        "grain": { "type": "string", "minLength": 1, "description": "What one row is." },
        "demo": {
          "type": "string",
          "pattern": "\\.csv$",
          "description": "The vendored demo extract under site/data/ that supplies this domain."
        },
        "columns": {
          "type": "object",
          "description": "The domain's columns, keyed by the default column name the modules expect.",
          "minProperties": 1,
          "additionalProperties": {
            "type": "object",
            "required": ["label", "description"],
            "additionalProperties": false,
            "properties": {
              "label": { "type": "string", "minLength": 1 },
              "description": { "type": "string", "minLength": 1 }
            }
          }
        }
      }
    },
    "module": {
      "type": "object",
      "required": ["export", "title", "domains", "settings"],
      "additionalProperties": false,
      "properties": {
        "export": {
          "type": "string",
          "pattern": "^[a-z][A-Za-z0-9]*$",
          "description": "The name the module is exported under from src/main.js."
        },
        "title": { "type": "string", "minLength": 1 },
        "domains": {
          "type": "array",
          "description": "The standard domains the module cannot draw without. Empty only for a module that reads none of them.",
          "items": { "$ref": "#/$defs/domainId" },
          "uniqueItems": true
        },
        "optionalDomains": {
          "type": "array",
          "description": "Standard domains the module uses when supplied.",
          "items": { "$ref": "#/$defs/domainId" },
          "uniqueItems": true
        },
        "externalDomains": {
          "type": "array",
          "description": "Domains the module reads that are outside the standard set, named as its own data schema names them. A module that lists any maps no settings here.",
          "items": { "type": "string", "minLength": 1 },
          "minItems": 1,
          "uniqueItems": true
        },
        "settings": {
          "type": "object",
          "description": "The module's column-name settings, keyed as in its data schema; a nested setting is written with a dot (color.value_col).",
          "additionalProperties": {
            "type": "object",
            "required": ["domain", "column", "required"],
            "additionalProperties": false,
            "properties": {
              "domain": {
                "description": "The domain the column is read from; a list when the same setting names a column in more than one table.",
                "oneOf": [
                  { "$ref": "#/$defs/domainId" },
                  {
                    "type": "array",
                    "items": { "$ref": "#/$defs/domainId" },
                    "minItems": 2,
                    "uniqueItems": true
                  }
                ]
              },
              "column": {
                "type": ["string", "null"],
                "description": "The manifest column the setting defaults to; null when the module's schema gives the setting no default."
              },
              "required": {
                "type": "boolean",
                "description": "Whether the module's schema lists the setting as required."
              }
            }
          }
        },
        "note": { "type": "string", "minLength": 1 }
      }
    }
  }
}
