{
  "$schema": "./schema/portfolio.json",
  "version": 2,
  "description": "The standard domain set a study supplies to safety.viz, and what every chart module reads from it. Column names are the ADaM-shaped defaults the modules already expect; each setting is the key in the module’s own data schema (src/data/schema/<module>.json), with the column it defaults to and whether that schema requires it. A test holds the two in agreement.",
  "domains": {
    "subject": {
      "label": "Subject-level",
      "grain": "One row per participant.",
      "demo": "adsl.csv",
      "columns": {
        "USUBJID": {
          "label": "Participant",
          "description": "Unique participant identifier; the key that joins every domain."
        },
        "ARM": {
          "label": "Treatment arm",
          "description": "Treatment group the participant was assigned to."
        },
        "SITEID": {
          "label": "Site",
          "description": "Investigational site identifier."
        },
        "SEX": {
          "label": "Sex",
          "description": "Participant sex."
        },
        "RACE": {
          "label": "Race",
          "description": "Participant race."
        },
        "EOSDY": {
          "label": "End-of-study day",
          "description": "Study day follow-up ended (day 1 = first dose); the censoring time for participants with no event."
        },
        "EOSSTT": {
          "label": "End-of-study status",
          "description": "End-of-study status, shown where a participant is censored."
        }
      }
    },
    "ae": {
      "label": "Adverse events",
      "grain": "One row per adverse event, plus one all-blank placeholder row per participant with no events.",
      "demo": "adae.csv",
      "columns": {
        "USUBJID": {
          "label": "Participant",
          "description": "Unique participant identifier."
        },
        "AESEQ": {
          "label": "Sequence",
          "description": "Sequence number of the event within the participant."
        },
        "AEBODSYS": {
          "label": "Body system",
          "description": "System organ class of the event."
        },
        "AEDECOD": {
          "label": "Preferred term",
          "description": "Dictionary-coded preferred term."
        },
        "AETERM": {
          "label": "Reported term",
          "description": "Verbatim term as reported."
        },
        "ASTDY": {
          "label": "Start day",
          "description": "Study day the event started (day 1 = first dose)."
        },
        "AENDY": {
          "label": "End day",
          "description": "Study day the event ended."
        },
        "ARM": {
          "label": "Treatment arm",
          "description": "Treatment group the participant was assigned to."
        },
        "AESEV": {
          "label": "Severity",
          "description": "Severity or intensity of the event."
        },
        "AESER": {
          "label": "Serious",
          "description": "Whether the event was serious (Y/N)."
        }
      }
    },
    "bds": {
      "label": "Labs and vitals",
      "grain": "One row per participant, measure and visit: laboratory results and vital signs together, in long format.",
      "demo": "adbds.csv",
      "columns": {
        "USUBJID": {
          "label": "Participant",
          "description": "Unique participant identifier."
        },
        "TEST": {
          "label": "Measure",
          "description": "Name of the laboratory test or vital sign."
        },
        "STRESN": {
          "label": "Result",
          "description": "Numeric result in standard units."
        },
        "STRESU": {
          "label": "Unit",
          "description": "Standard unit of the result."
        },
        "STNRLO": {
          "label": "Lower limit of normal",
          "description": "Lower limit of the normal range."
        },
        "STNRHI": {
          "label": "Upper limit of normal",
          "description": "Upper limit of the normal range."
        },
        "VISIT": {
          "label": "Visit",
          "description": "Visit name."
        },
        "VISITNUM": {
          "label": "Visit order",
          "description": "Numeric visit order."
        },
        "DY": {
          "label": "Study day",
          "description": "Study day of the measurement (day 1 = first dose)."
        },
        "ARM": {
          "label": "Treatment arm",
          "description": "Treatment group the participant was assigned to."
        },
        "SITEID": {
          "label": "Site",
          "description": "Investigational site identifier."
        },
        "SEX": {
          "label": "Sex",
          "description": "Participant sex."
        },
        "RACE": {
          "label": "Race",
          "description": "Participant race."
        }
      }
    },
    "eg": {
      "label": "ECG",
      "grain": "One row per participant, ECG interval and visit, in long format.",
      "demo": "adeg.csv",
      "columns": {
        "USUBJID": {
          "label": "Participant",
          "description": "Unique participant identifier."
        },
        "TEST": {
          "label": "Measure",
          "description": "Name of the ECG interval or parameter."
        },
        "STRESN": {
          "label": "Result",
          "description": "Numeric result in standard units."
        },
        "STRESU": {
          "label": "Unit",
          "description": "Standard unit of the result."
        },
        "BASE": {
          "label": "Baseline value",
          "description": "The participant’s baseline value for the measure."
        },
        "CHG": {
          "label": "Change from baseline",
          "description": "Result minus baseline."
        },
        "ABLFL": {
          "label": "Baseline flag",
          "description": "Marks the baseline record (Y)."
        },
        "ARM": {
          "label": "Treatment arm",
          "description": "Treatment group the participant was assigned to."
        },
        "VISIT": {
          "label": "Visit",
          "description": "Visit name."
        },
        "VISITNUM": {
          "label": "Visit order",
          "description": "Numeric visit order."
        }
      }
    }
  },
  "modules": {
    "histogram": {
      "export": "histogram",
      "title": "Safety Histogram",
      "domains": ["bds"],
      "settings": {
        "measure_col": {
          "domain": "bds",
          "column": "TEST",
          "required": true
        },
        "value_col": {
          "domain": "bds",
          "column": "STRESN",
          "required": true
        },
        "id_col": {
          "domain": "bds",
          "column": "USUBJID",
          "required": false
        },
        "unit_col": {
          "domain": "bds",
          "column": "STRESU",
          "required": false
        },
        "normal_col_low": {
          "domain": "bds",
          "column": "STNRLO",
          "required": false
        },
        "normal_col_high": {
          "domain": "bds",
          "column": "STNRHI",
          "required": false
        }
      }
    },
    "outlier-explorer": {
      "export": "outlierExplorer",
      "title": "Safety Outlier Explorer",
      "domains": ["bds"],
      "settings": {
        "measure_col": {
          "domain": "bds",
          "column": "TEST",
          "required": true
        },
        "value_col": {
          "domain": "bds",
          "column": "STRESN",
          "required": true
        },
        "id_col": {
          "domain": "bds",
          "column": "USUBJID",
          "required": false
        },
        "unit_col": {
          "domain": "bds",
          "column": "STRESU",
          "required": false
        },
        "normal_col_low": {
          "domain": "bds",
          "column": "STNRLO",
          "required": false
        },
        "normal_col_high": {
          "domain": "bds",
          "column": "STNRHI",
          "required": false
        }
      }
    },
    "results-over-time": {
      "export": "resultsOverTime",
      "title": "Safety Results Over Time",
      "domains": ["bds"],
      "settings": {
        "measure_col": {
          "domain": "bds",
          "column": "TEST",
          "required": true
        },
        "value_col": {
          "domain": "bds",
          "column": "STRESN",
          "required": true
        },
        "time_col": {
          "domain": "bds",
          "column": "VISIT",
          "required": true
        },
        "time_order_col": {
          "domain": "bds",
          "column": "VISITNUM",
          "required": false
        },
        "id_col": {
          "domain": "bds",
          "column": "USUBJID",
          "required": false
        },
        "unit_col": {
          "domain": "bds",
          "column": "STRESU",
          "required": false
        }
      }
    },
    "shift-plot": {
      "export": "shiftPlot",
      "title": "Safety Shift Plot",
      "domains": ["bds"],
      "settings": {
        "measure_col": {
          "domain": "bds",
          "column": "TEST",
          "required": true
        },
        "value_col": {
          "domain": "bds",
          "column": "STRESN",
          "required": true
        },
        "visit_col": {
          "domain": "bds",
          "column": "VISIT",
          "required": true
        },
        "visit_order_col": {
          "domain": "bds",
          "column": "VISITNUM",
          "required": false
        },
        "id_col": {
          "domain": "bds",
          "column": "USUBJID",
          "required": false
        },
        "unit_col": {
          "domain": "bds",
          "column": "STRESU",
          "required": false
        }
      }
    },
    "delta-delta": {
      "export": "deltaDelta",
      "title": "Safety Delta-Delta",
      "domains": ["bds"],
      "settings": {
        "measure_col": {
          "domain": "bds",
          "column": "TEST",